{
  "metadata": {
    "name": "cloud_native_startup",
    "description": "Cloud-native startup scenario with strong identity reliance and lower critical asset concentration",
    "version": "0.1",
    "industry": "technology"
  },
  "evaluation": {
    "runner": "phase63_mission_aware_product",
    "output_dir": "output/phase63_mission_products",
    "seeds": [0]
  },
  "missions": ["profit", "achievement", "persistence", "critical_hunter"],
  "products": [
    "profiles/products/sample_ids.json",
    "profiles/products/sample_ips.json",
    "profiles/products/sample_honeypot.json",
    "profiles/products/sample_deception.json",
    "profiles/products/sample_xdr.json"
  ],
  "topology": {
    "preset": "cloud_native"
  },
  "characteristics": {
    "critical_asset_count": 2,
    "identity_dependency": "high",
    "operational_sensitivity": "medium",
    "deception_effectiveness": "high"
  }
}
