{
  "metadata": {
    "name": "ot_factory",
    "description": "Operational technology factory scenario with high critical asset concentration and high operational sensitivity",
    "version": "0.1",
    "industry": "manufacturing"
  },
  "evaluation": {
    "runner": "phase63_mission_aware_product",
    "output_dir": "output/phase63_mission_products",
    "seeds": [0]
  },
  "missions": ["profit", "achievement", "persistence", "critical_hunter"],
  "products": [
    "profiles/products/sample_ids.json",
    "profiles/products/sample_ips.json",
    "profiles/products/sample_honeypot.json",
    "profiles/products/sample_deception.json",
    "profiles/products/sample_xdr.json"
  ],
  "topology": {
    "preset": "ot_environment"
  },
  "characteristics": {
    "critical_asset_count": 5,
    "identity_dependency": "medium",
    "operational_sensitivity": "high",
    "deception_effectiveness": "low"
  }
}
