{
  "metadata": {
    "name": "product_eval_basic",
    "description": "Product profile evaluation using sample product profiles",
    "version": "0.1"
  },
  "evaluation": {
    "runner": "phase62_product_profile",
    "output_dir": "output/phase62_product_profiles",
    "seeds": [0]
  },
  "missions": [
    "profit",
    "achievement",
    "persistence",
    "critical_hunter"
  ],
  "products": [
    "profiles/products/sample_ids.json",
    "profiles/products/sample_ips.json",
    "profiles/products/sample_honeypot.json",
    "profiles/products/sample_deception.json",
    "profiles/products/sample_xdr.json"
  ],
  "topology": {
    "preset": "default_enterprise"
  }
}
